08:22:09.668976 IP 172.20.10.1 > igmp.mcast.net: igmp v3 report, 1 group record(s)
08:22:10.400981 IP 172.20.10.6.40534 > 172.20.10.1.domain: 4607+ PTR? 22.0.0.224.in-addr.arpa. (41)
08:22:10.948097 IP 172.20.10.1.domain > 172.20.10.6.40534: 4607 1/0/0 PTR igmp.mcast.net. (69)
08:22:10.951960 IP 172.20.10.6.57288 > 172.20.10.1.domain: 12213+ PTR? 1.10.20.172.in-addr.arpa. (42)
08:22:11.072427 IP 172.20.10.1.domain > 172.20.10.6.57288: 12213 NXDomain 0/1/0 (119)
08:22:11.413720 IP 172.20.10.6.40527 > 172.20.10.1.domain: 30040+ PTR? 6.10.20.172.in-addr.arpa. (42)
08:22:11.431979 IP 172.20.10.1.domain > 172.20.10.6.40527: 30040 NXDomain 0/1/0 (119)
08:22:12.644913 IP 172.20.10.1 > igmp.mcast.net: igmp v3 report, 1 group record(s)
08:22:15.445537 ARP, Request who-has 172.20.10.1 tell 172.20.10.6, length 28
08:22:15.460322 ARP, Reply 172.20.10.1 is-at 76:29:59:1d:2e:64 (oui Unknown), length 46

